Institution,Institution_Country,Institution_State,Institution_Region_Census,Institution_Division_Census,Region (https://www.aamc.org/career-development/affinity-groups/gsa/member-schools-region#negsa)
Jefferson Medical College,USA,Pennsylvania,1 - NORTHEAST,2 - MIDDLE ATLANTIC,
YORK COLLEGE OF PENNSYLVANIA,USA,Pennsylvania,1 - NORTHEAST,2 - MIDDLE ATLANTIC,
University of Montreal Faculty of Medicine,Canada,NA,NA,NA,NA
Kottayam Medical College,India,NA,NA,NA,NA
Ramon Magsaysay Memorial Medical College,Philippines,NA,NA,NA,NA
Government Medical College at Amritsar,India,NA,NA,NA,NA
University of Pittsburgh School of Medicine,USA,Pennsylvania,1 - NORTHEAST,2 - MIDDLE ATLANTIC,
"Mahatma Gandhi Institute, Sevagram, India",India,NA,NA,NA,NA
VILLANOVA UNIVERSITY,USA,Pennsylvania,1 - NORTHEAST,2 - MIDDLE ATLANTIC,
Akademia Medyczna,Poland,NA,NA,NA,NA
R N T Medical College,India,NA,NA,NA,NA
Medical College of Pennsylvania,USA,Pennsylvania,1 - NORTHEAST,2 - MIDDLE ATLANTIC,
University of Karachi,Pakistan,NA,NA,NA,NA
"University of Chennai, Madras, India",India,NA,NA,NA,NA
Hahnemann University School of Medicine,USA,Pennsylvania,1 - NORTHEAST,2 - MIDDLE ATLANTIC,
University of Balamand,Lebanon,NA,NA,NA,NA
University of the Philippines at Manila,Philippines,NA,NA,NA,NA
National University of Ireland at Cork,Ireland,NA,NA,NA,NA
Philadelphia College of Osteopathic Medicine,USA,Pennsylvania,1 - NORTHEAST,2 - MIDDLE ATLANTIC,
University of the Philippines,Philippines,NA,NA,NA,NA
Dow Medical College,Pakistan,NA,NA,NA,NA
University of Pittsburgh,USA,Pennsylvania,1 - NORTHEAST,2 - MIDDLE ATLANTIC,
National Yang Ming Medical College,Taiwan,NA,NA,NA,NA
Duquesne University,USA,Pennsylvania,1 - NORTHEAST,2 - MIDDLE ATLANTIC,
Odessa Pirogov Medical Institute,Ukraine,NA,NA,NA,NA
Thomas Jefferson University,USA,Pennsylvania,1 - NORTHEAST,2 - MIDDLE ATLANTIC,
UNIVERSITY OF PENNSYLVANIA SCH OF NURSING,USA,Pennsylvania,1 - NORTHEAST,2 - MIDDLE ATLANTIC,
St. John Medical College,India,NA,NA,NA,NA
Nizhny Novgorod State Medical Academy,Russia,NA,NA,NA,NA
HAHNEMAN UNIVERSITY MEDICAL SCHOOL,USA,Pennsylvania,1 - NORTHEAST,2 - MIDDLE ATLANTIC,
Lock Haven University,USA,Pennsylvania,1 - NORTHEAST,2 - MIDDLE ATLANTIC,
Geisinger Commonwealth,USA,Pennsylvania,1 - NORTHEAST,2 - MIDDLE ATLANTIC,
Sidney Kimmel Medical College,USA,Pennsylvania,1 - NORTHEAST,2 - MIDDLE ATLANTIC,
Arcadia University,USA,Pennsylvania,1 - NORTHEAST,2 - MIDDLE ATLANTIC,
Slippery Rock University,USA,Pennsylvania,1 - NORTHEAST,2 - MIDDLE ATLANTIC,
Gannon University,USA,Pennsylvania,1 - NORTHEAST,2 - MIDDLE ATLANTIC,
DeSales University,USA,Pennsylvania,1 - NORTHEAST,2 - MIDDLE ATLANTIC,
State University of Liege,Belgium,NA,NA,NA,NA
Deccan College of Medical Sciences,India,NA,NA,NA,NA
"Mahatmagiandhi Mem Med School, Indore, INDIA",India,NA,NA,NA,NA
ST JOSEPHS HOSPITAL FATIMA UNIT,USA,Pennsylvania,1 - NORTHEAST,2 - MIDDLE ATLANTIC,
Philadelphia University,USA,Pennsylvania,1 - NORTHEAST,2 - MIDDLE ATLANTIC,
Tel Aviv University Sackler School of Medicine,Israel,NA,NA,NA,NA
LaSalle University,USA,Pennsylvania,1 - NORTHEAST,2 - MIDDLE ATLANTIC,
RHODE ISLAND COLLEGE,USA,Rhode Island,1 - NORTHEAST,1 - NEW ENGLAND,
Brown University School of Medicine,USA,Rhode Island,1 - NORTHEAST,1 - NEW ENGLAND,
Northern State Medical University,Russia,NA,NA,NA,NA
Warren Alpert Medical School of Brown University,USA,Rhode Island,1 - NORTHEAST,1 - NEW ENGLAND,
NOTRE DAME DE LA SAGESSE--HAITIEN,Haiti,NA,NA,NA,NA
JOHNSON AND WALES UNIVERSITY,USA,Rhode Island,1 - NORTHEAST,1 - NEW ENGLAND,
Angeles University Foundation - Philippines,Philippines,NA,NA,NA,NA
UNIVERSITY OF RHODE ISLAND,USA,Rhode Island,1 - NORTHEAST,1 - NEW ENGLAND,
COMMUNITY COLLEGE OF RHODE ISLAND,USA,Rhode Island,1 - NORTHEAST,1 - NEW ENGLAND,
BRISTOL COMMUNITY COLLEGE,USA,Rhode Island,1 - NORTHEAST,1 - NEW ENGLAND,
Bryant University,USA,Rhode Island,1 - NORTHEAST,1 - NEW ENGLAND,
Community College of RI - Lincoln,USA,Rhode Island,1 - NORTHEAST,1 - NEW ENGLAND,
University of Mumbai,India,NA,NA,NA,NA
Universite de Yaounde,Cameroon,NA,NA,NA,NA
Salve Regina University,USA,Rhode Island,1 - NORTHEAST,1 - NEW ENGLAND,
Newport Hospital School of Nursing,USA,Rhode Island,1 - NORTHEAST,1 - NEW ENGLAND,
Rhode Island Junior College,USA,Rhode Island,1 - NORTHEAST,1 - NEW ENGLAND,
COMM COLLEGE OF RI LINCOLN,USA,Rhode Island,1 - NORTHEAST,1 - NEW ENGLAND,
MEDYSZNE SYUDIUM W RZESZOWIE,Poland,NA,NA,NA,NA
Koyili School of Nursing,India,NA,NA,NA,NA
Community College of RI - Warwick,USA,Rhode Island,1 - NORTHEAST,1 - NEW ENGLAND,
Medical University of South Carolina,USA,South Carolina,3 - SOUTH,5 - SOUTH ATLANTIC,
Clemson University,USA,South Carolina,3 - SOUTH,5 - SOUTH ATLANTIC,
Midlands Technical College,USA,South Carolina,3 - SOUTH,5 - SOUTH ATLANTIC,
VANDERBILT UNIVERSITY,USA,Tennessee,3 - SOUTH,6 - EAST SOUTH CENTRAL,
University of Tennessee College of Medicine,USA,Tennessee,3 - SOUTH,6 - EAST SOUTH CENTRAL,
Francisco Marroquin University,Guatemala,NA,NA,NA,NA
South College,USA,Tennessee,3 - SOUTH,6 - EAST SOUTH CENTRAL,
TEXAS EL PASO UNIVERSITY,USA,Texas,3 - SOUTH,7 - WEST SOUTH CENTRAL,
Universidad De Buenos Aires,Argentina,NA,NA,NA,NA
Texas A & M University College of Medicine,USA,Texas,3 - SOUTH,7 - WEST SOUTH CENTRAL,
University of Texas at Dallas Southwestern Med Sch,USA,Texas,3 - SOUTH,7 - WEST SOUTH CENTRAL,
Nurses Training College,Ghana,NA,NA,NA,NA
Texas Tech. University School of Medicine,USA,Texas,3 - SOUTH,7 - WEST SOUTH CENTRAL,
University of Texas at Galveston Medical School,USA,Texas,3 - SOUTH,7 - WEST SOUTH CENTRAL,
University of North Texas Coll. of Osteopathic Med,USA,Texas,3 - SOUTH,7 - WEST SOUTH CENTRAL,
University of Texas at Houston Medical School,USA,Texas,3 - SOUTH,7 - WEST SOUTH CENTRAL,
Baylor College of Medicine,USA,Texas,3 - SOUTH,7 - WEST SOUTH CENTRAL,
University of Texas,USA,Texas,3 - SOUTH,7 - WEST SOUTH CENTRAL,
University of Utah,USA,Utah,4 - WEST,8 - MOUNTAIN,
University of Vermont College of Medicine,USA,Vermont,1 - NORTHEAST,1 - NEW ENGLAND,
University of Vermont,USA,Vermont,1 - NORTHEAST,1 - NEW ENGLAND,
OLD DOMINION UNIVERSITY,USA,Virginia,3 - SOUTH,5 - SOUTH ATLANTIC,
Virginia Commonwealth U. (Med. Coll. of Virginia),USA,Virginia,3 - SOUTH,5 - SOUTH ATLANTIC,
University of Virginia School of Medicine,USA,Virginia,3 - SOUTH,5 - SOUTH ATLANTIC,
Edward Via College of Osteopathic Medicine (VCOM),USA,Virginia,3 - SOUTH,5 - SOUTH ATLANTIC,
University of Washington (state) School of Med,USA,Washington,4 - WEST,9 - PACIFIC,
West Virginia University School of Medicine,USA,West Virginia,3 - SOUTH,5 - SOUTH ATLANTIC,
Alderson Broaddus College,USA,West Virginia,3 - SOUTH,5 - SOUTH ATLANTIC,
West Virginia School of Osteopathic Medicine,USA,West Virginia,3 - SOUTH,5 - SOUTH ATLANTIC,
University of Wisconsin Medical School,USA,Wisconsin,2 - MIDWEST,3 - EAST NORTH CENTRAL ,
Sahlgrenska Academy at University of Gothenburg,Sweden,NA,NA,NA,NA
Marquette University,USA,Wisconsin,2 - MIDWEST,3 - EAST NORTH CENTRAL ,
Medical College of Wisconsin,USA,Wisconsin,2 - MIDWEST,3 - EAST NORTH CENTRAL ,